{
  "format": 1,
  "evidence": {
    "core-registrations": {
      "inventories": ["core", "icu"],
      "sources": [
        "https://github.com/duckdb/duckdb/tree/d8cdaa33fda8df955cc76ef58a280f68f4cd43fa/src/function",
        "https://github.com/duckdb/duckdb/tree/d8cdaa33fda8df955cc76ef58a280f68f4cd43fa/extension/core_functions",
        "https://github.com/duckdb/duckdb/blob/d8cdaa33fda8df955cc76ef58a280f68f4cd43fa/src/function/register_function_list.cpp"
      ],
      "notes": ["The functions.json registration inputs (including aliases), function_list.cpp and generated headers distinguish scalar and aggregate registrations. RegisterFunctionList constructs the corresponding Create*FunctionInfo in system.main. Historical 1.5.5 signatures cross-check kinds; descriptive core.groups are not catalog kinds."]
    },
    "core-macros": {
      "inventories": ["core"],
      "sources": ["https://github.com/duckdb/duckdb/blob/d8cdaa33fda8df955cc76ef58a280f68f4cd43fa/src/catalog/default/default_functions.cpp"],
      "notes": ["DefaultMacro internal_macros explicitly distinguishes DEFAULT_SCHEMA (main) from pg_catalog. CreateInternalMacroInfo and the default generator preserve this schema. The 40 pg_catalog-only compute names retain historical classification but grant no fabricated main identity."]
    },
    "core-tables": {
      "inventories": ["core"],
      "sources": [
        "https://github.com/duckdb/duckdb/tree/d8cdaa33fda8df955cc76ef58a280f68f4cd43fa/src/function/table",
        "https://github.com/duckdb/duckdb/blob/d8cdaa33fda8df955cc76ef58a280f68f4cd43fa/src/function/built_in_functions.cpp"
      ],
      "notes": ["TableFunction/TableFunctionSet registrations in range.cpp, repeat.cpp, repeat_row.cpp, summary.cpp, unnest.cpp, system/duckdb_keywords.cpp, system/duckdb_optimizers.cpp and version/pragma_version.cpp. BuiltinFunctions targets the system catalog, default schema. range/generate_series/repeat also have separately reviewed scalar registrations."]
    },
    "unnest-intrinsic": {
      "inventories": ["core"],
      "sources": [
        "https://github.com/duckdb/duckdb/blob/d8cdaa33fda8df955cc76ef58a280f68f4cd43fa/src/planner/binder/expression/bind_unnest_expression.cpp",
        "https://github.com/duckdb/duckdb/blob/d4e72566aa8dcb35fc727e2a5ced8e9a2f6d8143/src/planner/binder/expression/bind_unnest_expression.cpp"
      ],
      "notes": ["SELECT-list unnest is a source-defined binder intrinsic, not a scalar catalog row. Gatekeeper assigns its intrinsic system.main scalar identity explicitly; the separately registered table form is not evidence for arbitrary scalar grants."]
    },
    "windows": {
      "inventories": ["core"],
      "sources": [
        "https://github.com/duckdb/duckdb/blob/d8cdaa33fda8df955cc76ef58a280f68f4cd43fa/src/parser/expression/window_expression.cpp",
        "https://github.com/duckdb/duckdb/blob/d8cdaa33fda8df955cc76ef58a280f68f4cd43fa/src/function/table/system/duckdb_functions.cpp",
        "https://github.com/duckdb/duckdb/blob/d8cdaa33fda8df955cc76ef58a280f68f4cd43fa/src/planner/binder/expression/bind_window_expression.cpp",
        "https://github.com/duckdb/duckdb/blob/d4e72566aa8dcb35fc727e2a5ced8e9a2f6d8143/src/parser/peg/transformer/transform_expression.cpp",
        "https://github.com/duckdb/duckdb/tree/d4e72566aa8dcb35fc727e2a5ced8e9a2f6d8143/src/function/window",
        "https://github.com/duckdb/duckdb/blob/d4e72566aa8dcb35fc727e2a5ced8e9a2f6d8143/src/function/register_function_list.cpp"
      ],
      "notes": ["internal_window_functions defines the 1.5 executable window intrinsics, represented by Gatekeeper as system.main window identities. duckdb_functions.cpp:194-220 constructs temporary reporting entries with OID 0 and labels them aggregate, explicitly noting that the label should be window. Those synthetic rows are NOT aggregate registrations and cannot authorize aggregate collisions. The 2.0 rows/ranking/values functions.json inputs register the same 13 names as window_function, including rank_dense. Historical reporting discrepancies are recorded separately without rewriting snapshots or expanding permissions.", "WindowFunctions maps first/last to WINDOW_FIRST_VALUE/WINDOW_LAST_VALUE; BindWindow constructs those intrinsic nodes without selecting a first/last window entry. Gatekeeper authorizes this pair as first_value/last_value, matching 2.0 TransformFunctionExpression's rewrite before window catalog selection. The 1.5 BindWindow preflight GetCatalogEntry still retrieves first/last's real aggregate entries; their exact aggregate authorization and evidence remain separate. No first/window or last/window default is justified. rank_dense retains its own spelling, explicitly registered on 2.0. This source-defined syntax mapping does not equate configurable names or reattribute host macros."]
    },
    "rounding-2.0": {
      "inventories": ["core"],
      "sources": [
        "https://github.com/duckdb/duckdb/blob/d4e72566aa8dcb35fc727e2a5ced8e9a2f6d8143/extension/core_functions/scalar/math/functions.json",
        "https://github.com/duckdb/duckdb/blob/d4e72566aa8dcb35fc727e2a5ced8e9a2f6d8143/src/function/register_function_list.cpp"
      ],
      "notes": ["The 2.0 registration explicitly defines round_even as scalar_function_set with roundbankers alias. Keep these concrete scalar identities alongside the historical macro identities; existing implementation classifications remain trusted."]
    },
    "json": {
      "inventories": ["core", "json"],
      "sources": [
        "https://github.com/duckdb/duckdb/blob/d8cdaa33fda8df955cc76ef58a280f68f4cd43fa/extension/json/json_extension.cpp",
        "https://github.com/duckdb/duckdb/blob/d8cdaa33fda8df955cc76ef58a280f68f4cd43fa/extension/json/json_functions.cpp",
        "https://github.com/duckdb/duckdb/tree/d8cdaa33fda8df955cc76ef58a280f68f4cd43fa/extension/json/json_functions"
      ],
      "notes": ["GetScalarFunctions includes explicit AddAliases; GetTableFunctions registers json_each/json_tree. json_extension.cpp DefaultMacro definitions register json and the three json_group_* macros under DEFAULT_SCHEMA through ExtensionLoader. Historical kinds cross-checked."]
    },
    "icu": {
      "inventories": ["icu"],
      "sources": ["https://github.com/duckdb/duckdb/tree/d8cdaa33fda8df955cc76ef58a280f68f4cd43fa/extension/icu"],
      "notes": ["icu_extension.cpp GetICUCollateFunction constructs scalar icu_collate_ names from the embedded locale list; RegisterCollation also registers a scalar function. Explicit locale names below are the historically reviewed inventory, cross-checked against its baseline, not a live locale expansion. icu-current.cpp, icu-makedate.cpp and icu-timezone.cpp register the remaining scalars; icu_calendar_names and pg_timezone_names are TableFunction registrations. Shared core names are covered by their identical core identity; icu-table-range.cpp and icu-list-range.cpp confirm both range kinds."]
    },
    "autocomplete": {
      "inventories": ["autocomplete"],
      "sources": ["https://github.com/duckdb/duckdb/blob/d8cdaa33fda8df955cc76ef58a280f68f4cd43fa/extension/autocomplete/autocomplete_extension.cpp"],
      "notes": ["LoadInternal registers check_peg_parser_fun as TableFunction through ExtensionLoader; optional extension absent from historical Python baseline."]
    },
    "delta": {
      "inventories": ["delta"],
      "sources": ["https://github.com/duckdb/duckdb-delta/blob/45c40878601b54b4188b09e08732fe0d576ad222/src/delta_macros.cpp"],
      "notes": ["delta_macros defines parse_delta_filter_logline as DefaultMacro DEFAULT_SCHEMA; RegisterMacros passes CreateInternalMacroInfo to ExtensionLoader. Not a scalar function despite its scalar-shaped use. Absent from historical Python baseline."]
    },
    "ducklake": {
      "inventories": ["ducklake"],
      "sources": [
        "https://github.com/duckdb/ducklake/blob/d8a1881e22516ea3d186d73e83c65fe5bd1a1dc4/src/functions/ducklake_murmur3.cpp",
        "https://github.com/duckdb/ducklake/blob/d8a1881e22516ea3d186d73e83c65fe5bd1a1dc4/src/ducklake_extension.cpp"
      ],
      "notes": ["ScalarFunction murmur3_32 registered through ExtensionLoader; absent from historical Python baseline."]
    },
    "excel": {
      "inventories": ["excel"],
      "sources": ["https://github.com/duckdb/duckdb-excel/blob/f4c72b5ef04a03b3a78a95b5a2ee94ba93e3178d/src/excel/excel_extension.cpp"],
      "notes": ["LoadInternal registers text_func and excel_text_func ScalarFunctions through ExtensionLoader; absent from historical Python baseline."]
    },
    "fts": {
      "inventories": ["fts"],
      "sources": ["https://github.com/duckdb/duckdb-fts/blob/6814ec9a7d5fd63500176507262b0dbf7cea0095/extension/fts/fts_extension.cpp"],
      "notes": ["LoadInternal registers stem_func ScalarFunction through ExtensionLoader; absent from historical Python baseline."]
    },
    "iceberg": {
      "inventories": ["iceberg"],
      "sources": [
        "https://github.com/duckdb/duckdb-iceberg/blob/45163a28e0ed6a2071a82a1bf1dd432d0216cf9c/src/function/iceberg_scalar_functions.cpp",
        "https://github.com/duckdb/duckdb-iceberg/blob/45163a28e0ed6a2071a82a1bf1dd432d0216cf9c/src/iceberg_extension.cpp"
      ],
      "notes": ["Explicit ScalarFunctionSet iceberg_bucket and iceberg_truncate flow through GetScalarFunctions and ExtensionLoader; absent from historical Python baseline."]
    },
    "inet": {
      "inventories": ["inet"],
      "sources": [
        "https://github.com/duckdb/duckdb-inet/blob/fe7f60bb60245197680fb07ecd1629a1dc3d91c8/src/inet_extension.cpp",
        "https://github.com/duckdb/duckdb-inet/blob/fe7f60bb60245197680fb07ecd1629a1dc3d91c8/src/inet_escape_functions.cpp"
      ],